{
	"title": "Dino drop loot tables",
	"type": "object",
	"properties": {
		"version": {
			"title": "Version",
			"description": "Data version of the format <gamemajor>.<gamemajor>.<specificversion>, e.g. '306.83.4740398'",
			"type": "string"
		},
		"format": {
			"title": "Format",
			"description": "Free-form format identifier, changed only when incompatibilities are introduced",
			"type": "string"
		},
		"mod": {
			"title": "Mod info",
			"description": "Source module information",
			"allOf": [
				{
					"$ref": "#/definitions/ModInfo"
				}
			]
		},
		"drops": {
			"title": "Drops",
			"description": "List of loot crates",
			"type": "array",
			"items": {
				"$ref": "#/definitions/Drop"
			}
		}
	},
	"required": [
		"version",
		"format",
		"drops"
	],
	"additionalProperties": false,
	"$schema": "http://json-schema.org/draft-07/schema#",
	"definitions": {
		"ModInfo": {
			"title": "ModInfo",
			"type": "object",
			"properties": {
				"id": {
					"title": "Mod ID",
					"type": "string"
				},
				"tag": {
					"title": "Blueprint tag",
					"description": "Used in place of the mod ID in blueprint paths",
					"type": "string"
				},
				"title": {
					"title": "Mod name",
					"type": "string"
				}
			},
			"required": [
				"id",
				"tag",
				"title"
			]
		},
		"MinMaxPowerRange": {
			"title": "MinMaxPowerRange",
			"type": "object",
			"properties": {
				"min": {
					"title": "Min",
					"anyOf": [
						{
							"type": "number"
						},
						{
							"type": "integer"
						},
						{
							"type": "number"
						}
					]
				},
				"max": {
					"title": "Max",
					"anyOf": [
						{
							"type": "number"
						},
						{
							"type": "integer"
						},
						{
							"type": "number"
						}
					]
				},
				"pow": {
					"title": "Power",
					"description": "Affects the power curve used to select a value in the range",
					"anyOf": [
						{
							"type": "number"
						},
						{
							"type": "integer"
						},
						{
							"type": "number"
						}
					]
				}
			},
			"required": [
				"min",
				"max",
				"pow"
			],
			"additionalProperties": false
		},
		"ItemSetEntry": {
			"title": "ItemSetEntry",
			"type": "object",
			"properties": {
				"name": {
					"title": "Name",
					"type": "string"
				},
				"weight": {
					"title": "Weight",
					"type": "number"
				},
				"qty": {
					"$ref": "#/definitions/MinMaxPowerRange"
				},
				"quality": {
					"$ref": "#/definitions/MinMaxPowerRange"
				},
				"forceBP": {
					"title": "Forcebp",
					"type": "boolean"
				},
				"items": {
					"title": "Items",
					"type": "array",
					"items": {
						"type": "string"
					}
				}
			},
			"required": [
				"weight",
				"qty",
				"quality",
				"forceBP",
				"items"
			],
			"additionalProperties": false
		},
		"ItemSet": {
			"title": "ItemSet",
			"type": "object",
			"properties": {
				"name": {
					"title": "Name",
					"type": "string"
				},
				"weight": {
					"title": "Weight",
					"anyOf": [
						{
							"type": "number"
						},
						{
							"type": "number"
						}
					]
				},
				"qtyScale": {
					"$ref": "#/definitions/MinMaxPowerRange"
				},
				"entries": {
					"title": "Entries",
					"type": "array",
					"items": {
						"$ref": "#/definitions/ItemSetEntry"
					}
				}
			},
			"required": [
				"weight",
				"qtyScale",
				"entries"
			],
			"additionalProperties": false
		},
		"Drop": {
			"title": "Drop",
			"type": "object",
			"properties": {
				"bp": {
					"title": "Bp",
					"description": "Full blueprint path",
					"type": "string"
				},
				"sets": {
					"title": "Sets",
					"description": "Loot sets",
					"type": "array",
					"items": {
						"$ref": "#/definitions/ItemSet"
					}
				}
			},
			"required": [
				"bp"
			],
			"additionalProperties": false
		}
	}
}